Овны	Тельцы	Близнецы	Рак	Лев	Девы	Весы	Скорпион	Стрелец	Козерог	Водолей	Рыбы	date
. 28 июня.??Ух, сегодня много приятных встреч и полезных знакомств вас ожидают. Прям ждут, не дождутся!??	. 28 июня.??Всё будет хорошо. Действительно, даже если что-то сейчас не клеится – у вас есть чему радоваться. Всё будет просто идеально, звёзды обещают!??	. 28 июня.??Все, что сегодня нужно Близнецам - любимый человек, летний закат и нежные слова на ушко..??Рак. 28 июня.??Раки приносят удачу всем рядом находящимся, поэтому, 	и, сегодня будьте рядом с теми, кто вам действительно дорог.??	. 28 июня.??Львы — хватит быть такими хорошими, доброта это прекрасно, но хватит.. Вы должны поступать с людьми так, как и они с вами!??	. 28 июня.??У Дев сейчас такой период, когда уже нет сил что-то объяснять, о чем-то просить, уговаривать, ссориться.. Им проще просто послать все к черту.??	. 28 июня.??Ну все, пришло время признаваться в своих чувствах. Да-да, а что вы хотели, думали скрывать это всю жизнь? Признавайтесь, все получится!?? Скорпион. 28 июня.??	ы. сегодня день невероятных событий. Возможны романтические увлечения, есть вероятность начала серьезных отношений. Вот это нежданчик, правда????	. 28 июня.??Сегодня удача будет вашей гостьей. Так что встречайте ее очень радушно, у нее много приятностей для вас!??	. 28 июня.??Так, ну хватит с самого утра причитать, что жизнь не удалась. Посмотрите в зеркало, такое прекрасное личико не достойно огорчений!??	. 28 июня.??Взаимоотношения становятся всё теплее и теплее. Скоро они нагреются и взорвутся фонтаном любви, радости и обалденных эмоций!??	. 28 июня.??Что за день! Ещё никогда вы так хорошо не просыпались утром, не проводили день настолько круто и продуктивно и не ложились спать с таким чувством полного удовлетворения!@moygoroskop ??	28.06.2020
. 29 июня.??Работа у Овна пойдет по накатанной колее, если он сам не собьется с пути. Нужно быть крайне предусмотрительным и планомерным, чтобы выполнить все задуманное.??	. 29 июня.??Сегодня не следует принимать кардинальных решений. Главное - сохранить внутреннее равновесие и оградиться от искушений.??	. 29 июня.??В любви Близнецам сегодня лучше действовать в своих интересах. Не идите на поводу у чувств, иначе ошибок будет уйма. Ну, а также грустных и тягостных разочарований.??	. 29 июня.??Сегодняшний день стоит провести в теплой компании. Если вас еще не пригласили на вечеринку, устройте ее сами.??	"??Возможностей у Львов сегодня будет море! Выбирайте самые классные и получайте все самое крутое! ;)??"	. 29 июня.??Вы должны поступать мудро и оставить прошлое позади, начав что-то новое. Не цепляйтесь за старое, хоть это и сложно, будьте благорозумны!??	. 29 июня.??У вас начинается светлый период. Перспективы приходят на смену событиям, которые огорчали вас. Классно, правда??? 	". 29 июня.??Сегодня определенно ваш день! Все дела будут решаться с легкостью, а настроение будет на высоте ;). Наслаждайтесь моментом и посвятите сегодняшний день себе.??"	. 29 июня.??В жизнь Стрельцов может постучаться новый человек, которому стоит приоткрыть дверцу в свое сердце. Решайтесь!??	. 29 июня.??Сегодня вам хорошо было бы вспомнить, что ваши поступки должны быть не одобрены со стороны, а поддерживаться единогласно вашими интуицией, мозгом и сердцем. Захотели - сделали!??	. 29 июня.??Почему все ждут, что Водолеи первые напишут, позвонят, скажут, как соскучились...им тоже, между прочем, хотелось бы услышать эти слова.??	. 29 июня.??Момент просто идеален для реализации самых смелых планов, желаний и даже несбыточных мечтаний! Вставайте же, че сидите до сих пор?@moygoroskop ??	29.06.2020
. 30 июня.??Не бойтесь сделать первый шаг и рискнуть своим вполне приличным на даный момент положением. Вы получите гораздо больше, нежели у вас уже есть.??	. 30 июня.??Сегодня вас ждет нелегкий выбор. Определиться с решением будет непросто, однако стоит потрудиться, поскольку результат будет более чем достойный.??	. 30 июня.??Постарайтесь сегодня не дать себе ни малейшего шанса сбиться с пути истинного, ибо возвратиться потом на него обратно сложнее, чем вы думаете.??	. 30 июня.??Сегодня точно ваш день! Будет очень приятный сюрприз под конец дня, ждите!??	". 30 июня.??Вы, возможно, присоединились не к той компании. Взвесьте все ""за"" и ""против"", может быть, вы поймете, что пора не просто менять окружение, а что это надо сделать как можно быстрее.??"	. 30 июня.??Сегодня вам стоит пересмотреть и, возможно, переосмыслить то, что вы делали в последнее время. Может быть, вам захочется что-то изменить.??	. 30 июня.??Не сдавайтесь - вы находитесь уже на самом пороге. Нужно только не побоятся войти.?? 	. 30 июня.??Сегодня благоприятны одиночество и сосредоточение на духовных проблемах. Для реализации поставленных задач понадобятся покой, терпение и трезвый расчет.??	. 30 июня.??Сохраняйте выдержку и хладнокровие. Не реагируйте на то, что происходит, - многое зависит не только от вас.??	. 30 июня.??Этот день благоприятен для восстановления дружеских отношений. Будьте готовы к неожиданным встречам с давними друзьями или близкими людьми.??	. 30 июня.??Неприятности обойдут вас стороной, получится все, что вы наметите. Можно на время забыть про ссоры, взаимное непонимание, размолвки.??	. 30 июня.??Придерживайтесь характерного для вас некоторого отстранения от окружающих. Никого не следует посвящать в свои проблемы или планы. Как можно меньше доверительных бесед с малознакомыми людьми.@moygoroskop ??	30.06.2020
.1 июля.??Весь день пройдет в красочных тонах, смех и радость будут вашими спутниками. Вы в центре внимания.??	.1 июля.??Сегодня лучшей инвестицией в дело собственного благополучия будет любое бескорыстное деяние. Воздастся вам, конечно, не сразу, но когда-нибудь - непременно.??	.1 июля.??Сегодня вас спасет лишь терпение, терпение и еще раз спокойствие. Сделайте вид, что происходящее вас не касается, и вы с успехом доживете до конца дня.??	.1 июля.??Сегодня вам предстоит сделать что-то, чего вы никогда не делали ранее. Это отнимет массу нервной энергии, зато наполнит день смыслом. Вам понравится!??	.1 июля.??День этот может оказаться для вас исключительно плодотворным. Но только при одном условии. Ни в коем случае не давайте испортить себе настроение.??	.1 июля.??Успешность ваших сегодняшних деяний целиком и полностью зависит от вашей веры в собственные силы. Все остальное вам будет обеспечено.??	.1 июля.??Сегодня вам очень поможет способность сделать комплемент нужному человеку в нужный момент. Этого будет достаточно, дальше все пойдет как по маслу.?? 	.1 июля.??Будьте сегодня добрым и отзывчивым. Обращайте побольше внимания на то, что творится вокруг вас.??	.1 июля.??Если кто и знает, что вам на самом деле нужно, так только вы, и никто более. И ни от кого так не зависит, обретете ли вы необходимое, как от вас самих, особенно сегодня.??	.1 июля.??Что бы ни происходило, сегодня вы будете центром всеобщего внимания. Укрыться от этой чести не удастся, придется потерпеть.??	.1 июля.??Этот день просто необходимо отдать романтическим похождениям. Эффект будет незабываемым.??	.1 июля.??Не скрывайте сегодня ваших желаний, возможно кто-то хочет того же и вы сможете объединить усилия.@moygoroskop ??	01.07.2020
. 2 июля??Вы явно сегодня задались целью пробить своей напористостью любые стены. Не останавливайтесь, все получится!??	. 2 июля??Сегодня вас неожиданно посетит вдохновение. А значит, любые творческие начинания будут успешны.??	. 2 июля??В случае если что-то в работе пошло не по плану, не бросайтесь переделывать — может, так даже и лучше.??	. 2 июля??Какими бы ни были проблемы, у них есть и свои плюсы. Не стоит бояться принимать решения, потому что любой принятый вариант будет правильным.??	. 2 июля??Ваши длительные и тяжелые труды, которые раньше были проигнорированы, наконец-то вознаградятся. Не стесняйтесь принимать активное участие в батлах и обсуждениях. Ваша харизма поможет привлечь полезное внимание.??	. 2 июля??Благодаря вашей настойчивости, последнее слово останется за вами. Уверенность и активность позволят добиться желаемого.??	. 2 июля??Некоторые события заставят вас очень удивиться и, возможно, не поверить своим глазам. Постарайтесь освободиться от давления со всех сторон, особенно на работе.?? 	. 2 июля??Вам не придется тратить много усилий, чтобы получить желаемое. Если все в порядке и дорога, по которой вы идете, ровная - значит, вы двигаетесь правильно.??	. 2 июля??Вам придется отправиться в путешествие или планировать его. Ваша энергия будет просто поразительной.??	. 2 июля??Вы можете быть излишне активными, что вызовет осуждения и зависть со стороны окружающих. Вы будете успевать везде: сможете активно поработать и с шумом развлечься, погрустить и от живота посмеяться.??	. 2 июля??День может быть непростым и даже противоречивым. Он обещает не только новые интересные знакомства, но и расставания с давними, ни к чему не приводящими иллюзиями.??	. 2 июля??Звезды предупреждают Рыб, что сегодня необходимо собрать все силы и ресурсы, чтобы этот день прожить с минимальными потерями. Отступят все невзгоды и удастся вздохнуть полной грудью, если не начнете паниковать.@moygoroskop ??	02.07.2020
. 3 июня.??Вы холодны как айсберг на северном полюсе к тем, кто проявляет к вам симпатию и сладкие чувства. Дело ваше конечно, но, честно говоря, так себе успех...??	. 3 июня.??Вскружить кому-то голову или разбить сердце вы можете в считанные минуты, это конечно прекрасно, только сами не потеряйте хладнокровие, а то мало ли.??	. 3 июня.??Наконец-то, поймали правильную волну, супер. Принимайте окончательное решение и кайфуйте на здоровье!??	. 3 июня.??Не бойтесь нарушить привычный ход событий, выйти за рамки скучной повседневности, проявить инициативу. Творите неформат!??	. 3 июня.??День - боль. Настроение - боль. Личная жизнь - боль. Погода - боль. Главное во всем стабильность. Но не грустите - скоро всееее наладится!??	. 3 июня.?Пришло время великих потрясающих перемен, скорее за мечтой! Звезды за Дев!??	. 3 июня.??Вы как белка , в том самом колесе. Пора взять паузу, попить водички и послать все к чертям собачьим.?? 	. 3 июня.??Эй, пора принимать решения! Откладывать дальше нету смысла! Ваши союзники и товарищи верны вам и готовы прийти на помощь, как черный плащ, - в любой момент!??	. 3 июня.??Стрельцы пошли лечить нервы... Будут поздно, пьяные, добрые и счастливые!??	. 3 июня.??Старайтесь держаться подальше от тех, кто пробуждает в вас негативные эмоции. С сволочами вообще лучше дела не иметь.??	. 3 июня.??Ваша интуиция сегодня остра и дает только верные подсказки. Сегодня вас ждет много новостей. Все новости классные, и порадуют вас!??	. 3 июня.??К вам проявляют чрезмерное внимание? А чему вы удивляетесь? Пора бы уже и пофлиртовать как следует!@moygoroskop ??	03.07.2020
. 4 июля.??Не оглядывайся назад. Всё время иди вперёд. Люди, которые тебе действительно нужны, обязательно тебя догонят.??	. 4 июля.??Всё будет хорошо. Действительно, даже если что-то плохо – у вас есть чему радоваться. Всё будет просто идеально, звёзды обещают!??	. 4 июля.??Что то вы очень милые стали.. пора выпустить коготки! И расцарапать личико недоброжелателям и завистникам!??	. 4 июля.??Не смущайтесь – событий будет очень много, но это только подготовительный этап! Вскоре начнётся реальная жара и драйв, вы ещё устанете радоваться и улыбаться!??	. 4 июля.??День действительно шикарный, стоит довести начатое до конца и начать незаконченное. В общем делайте что вам вздумается, все равно успех вас ожидает в любом начинании!??	. 4 июля.??Следует различать оказание помощи и те ситуации, когда какое-то несчастье на шею вам пытается забраться!??	. 4 июля.??День офигенно настроен на спонтанные решения. Зачем семь раз мерить, если с первого всё ясно??? 	. 4 июля.??Вы слишком серьёзно ко всему подходите, прекращайте! Больше позитива и веселья, и всё будет намного легче!??	. 4 июля.??Многие хотят вас видеть. Кого наградить своим присутствием выбирать только вам!??Козерог. 4 июля.??	и, помните, что сбежать от людей и обстоятельств вполне возможно, но от чувств и эмоций наверно никогда..??	. 4 июля.??Не стоит по привычке или из чувства долга держаться за людей, которые вас не устраивают. К хорошему это обычно не приводит.??	. 4 июля.??Глядя на вас, хочется спросить: «Как такой обалденный человек может думать о плохом?». Не отвечайте, просто выкиньте все плохое из головы.@moygoroskop ??	04.07.2020
. 5 июля.??Сегодня о вас вспомнят те, кто уже давно прекратил с вами отношения. Устройте встречу, если ностальгия вам не чужда.??	. 5 июля.??Ваше очарование непременно заметят представители противоположного пола! Можете замутить любовную интрижку о которой давно мечтали.??	. 5 июля.??Близнецам нужны настоящие чувства, а не фигня какая-нибудь на следующие месяц-два.??	. 5 июля.??Сегодняшний день будет довольно странным для вас. Вы будете абсолютно не понимать, что же вокруг вас происходит и чем это закончится. Тем интереснее)??	. 5 июля.??Львы самые привлекательные люди на Земле. Сегодня это в очередной раз поймут те, кто нихрена не понял.??	. 5 июля.??Вас ждет то, что вы так давно хотели! Да-да. Осталось немного!??	. 5 июля.??Не стесняйтесь послать нахер людей, которые пользуются вашей энергией! Вампиры хреновы.?? 	. 5 июля.??Ваше будущее – ваши мысли. Не надо думать обо всякой херне, если не хотите потом её встретить!??	. 5 июля.??Можете спокойно сесть на жопку, подвести итоги проделанной работы и покайфовать. Вы заслужили отдых и уважение близких. Получите, распишитесь.??	. 5 июля.??Сегодня вы будете как никогда более уверены в собственных силах. Ребятки, вы действительно очень многое можете себе позволить.??	. 5 июля.??Хватит ждать смски или звонка. Забейте хер, идите развлекаться – надо будет – найдёт вас??	. 5 июля.??Сюрпризов будет очень много, а шансов изменить свою будущее ещё больше. Хватайтесь за каждый.@moygoroskop ??	05.07.2020
