Овны	Тельцы	Близнецы	Рак	Лев	Девы	Весы	Скорпион	Стрелец	Козерог	Водолей	Рыбы	date
. 27 мая. ??Овны научат вас скучать по ним... Понять, что время учит, а не лечит... Что счастье - каждый миг наедине... И что в разлуке лишь желанней встреча... Они научат вас их хотеть... До умопомрачения, до боли... Чтобы, не прикасаясь, ими владеть... И ощущать, как они полны вами... Овны всё принять могут и все понять. Любить и ждать, почти что не ревнуя. Вы лишь сумейте их не потерять. Но этому вас не научат, они..??	. 27 мая. ??Тельцы никогда не понимали и не поймут тех людей, которые играют с чужими искренними чувствами..??Близнецы. 27 мая. ??	 у вас теперь все будет хорошо!??Рак. 27 мая. ??Мило, когда другие люди ревнуют. Когда ревнуют 	и, начитается третья мировая война.??	. 27 мая. ??Чтобы завоевать Львов - нужно терпение, чтобы удержать - внимание, чтобы потерять - равнодушие ... Никогда не играйте с Львами ... вы не знаете, а вдруг, они играют лучше вас.??	. 27 мая. ??Не смотря на то, что у всех слюни на вас текут – ваше сердце принадлежит одному человеку!??	. 27 мая. ??Сердце Весов открыто лишь для тех, кто умеет Его любить, слышать Его стук и понимать Его.. Для остальных сердце Весов заперто на семь замков и еще сзади подпёрто табуреткой.??Скорпион. 27 мая. ??Скорпионы либо вообще не спят, либо спят сутками. либо вообще не едят, либо нажираются как надо. либо не смотрят сериал, либо за день весь сезон. Вот такие вот 	ы, любят крайности.??	. 27 мая. ??Раньше Стрельцы очень переживали из-за всяких лицемеров, лжецов и прочих дураков.. А сейчас Стрельцам по фиг.. они концентрируют всю свою любовь и внимание исключительно на тех людей, которых любят и которые любят Их..??Козерог. 27 мая. ??	и пройдет время, и жизнь покажет, что все было только к лучшему.??Водолей. 27 мая. ??У Водолея достаточно много недоброжелателей и завистников, а всё потому, что Он чересчур искренен.. чересчур прямой.. чересчур прямолинеен.. Многим это не нравится.. А иначе 	 не умеет..??Рыбы.27 мая. ??	 ненавидят когда Им врут.. Просто ненавидят и всё.. Поэтому люди, сделайте Рыбам одолжение — НЕ ВРИТЕ ИМ НИКОГДА!!!@moygoroskop ??	27.05.2020
. 28 мая. ??Плохо Овну, иль хорошо, кому какое дело! Просто жизни колесо вот так вот завертело! Упадет и встанет вновь, отряхнет колени. Не родился еще тот, кто сломать сумеет!??	. 28 мая. ??Да, Тельцы вредные! Хамят. Иногда ругаются матом. Зато у них глаза красивые..??Близнецы. 28 мая. ??	 — кто-то постоянно о Вас думает.. Вообще постоянно.. И этот человек ничего не может с собой поделать.. Вы просто не выходите у него из головы??	. 28 мая. ??Вот теперь-то у вас всё будет хорошо. Можете не сомневаться. Это белая полоса.??	". 28 мая. ??Львы искренне верят, что когда-нибудь настанет время, когда судьба отойдет в сторонку и скажет: ""Вам достаточно испытаний. Живите спокойно.. Будьте счастливы..""??"	. 28 мая. ??У Дев все просто, если человек разочаровал их — Они исключают Его из своей жизни. Девы могут с ним здороваться и разговаривать, но как человек для Них он уже не существует..??Весы. 28 мая. ??	, научитесь обижаться на людей, а то вы слишком быстро всех прощаете, а потом наступаете на те же грабли.??Скорпион. 28 мая. ??Слишком сильные, слишком вредные, слишком гордые. Если кто искал такую проблему на свою голову, обращайтесь. 	ы еще готовить умеют.??	. 28 мая. ??Стрельцы — Вы зря переживаете.. Скоро вся грусть улетучится и в Вашей жизни появится человек, который подарит Вам счастье.. Истинное счастье..??Козерог. 28 мая. ??	и — уже совсем скоро в Вашей жизни начнется белая полоса.. Широкая и ооооочень длинная белая полоса..??	. 28 мая. ??Было бы замечательно, если бы кто-нибудь дал Водолею денег. Просто так. Просто за то, что Он есть..??Рыбы. 28 мая. ??	 — кто-то хочет Вас до безумства.. У этого человека просто крыша едет при виде Вас.. Вы даже не представляете себе, как он Вас любит..@moygoroskop ??	28.05.2020
. 29 мая. ??Никогда не осуждайте Овнов.. Вы же не были на Их месте, не знаете о чем Они думают, что чувствуют и что пережили.. А пережили Они много всего.. Поэтому не судите Овнов.. Вы себе даже не представляете, что прячется за Их доброй улыбкой..??Телец. 29 мая. ??Телец не тот знак, который будет вестись на пустые обещания и красивые слова.. Телец уже не тот, что раньше.. 	 научен горьким опытом и уже не верит всяким дуракам...??Близнецы. 29 мая. ??	 — начиная с сегодняшнего дня Вас ждет совершенно новая жизнь.. Увлекательная, веселая, местами экстремальная, но в целом радостная и счастливая..??Рак. 29 мая. ??Хотите покорить Рака? Хотите, чтобы Рак Вас любил, уважал и обожал? — Просто будьте искренними, честными, дарите 	у тепло, заботу, уют, а главное — НИКОГДА НЕ ОБМАНЫВАЙТЕ и будьте ПРЕДАННЫМИ. Вот и всё.?? Лев. 29 мая. ??Лев не любит когда Его критикуют, учат жизни и пытаются изменить — 	 любит когда Его любят, уважают, угощают вкусностями и подливают винишко в бокал..??	. 29 мая. ??У Дев слишком много завистников.. А все потому, что Девы простые, искренние и настоящие.. Многим это не нравится, вот и завидуют..??Весы. 29 мая. ??	 ненавидят ложь.. Ненавидят и точка! Стоит Вам хоть раз соврать Весам и уже никогда Их отношение к Вам не будет прежним..??Скорпион. 29 мая. ??Все что сейчас нужно 	у — это просто знать, что Он нужен.. Что Его любят.. Что Его никогда не бросят и никогда не предадут.. А еще, чтобы лето было теплым и ласковым...??	. 29 мая. ??Сломать Стрельцов невозможно, если у них есть цель и чуточку веры. Их душа готова пройти семь кругов ада, чтоб взять от жизни то, что им нужно.??Козерог. 29 мая. ??У 	а все просто: Он ценит все то, что у Него есть. Стремится к тому, чего у Него еще нет. С легкостью расстается с тем, что Ему не надо. И просто любит жизнь и тех людей, которые с Ним рядом..:)??	. 29 мая. ??У Водолеев есть человек, которого нет рядом, но он безумно дорог..И часть вашей души всегда будет только с ним.??Рыбы. 29 мая. ??	 могут многое понять, простить и вытерпеть.. Но, лишь две вещи по-настоящему выводят их из себя — это неопределенность.. И неблагодарность..@moygoroskop ??	29.05.2020
. 30 мая. ??Главное для Овна — чтобы Его ценили.. Или цените, или валите нафиг..??	. 30 мая. ??Несмотря на многочисленные искушения и соблазны, вы храните верность своим принципам и нравственным правилам, это в который раз доказывает вашу офигенность. Люди чувствуют это. И Вам респектуют.??	. 30 мая. ??Люди, помните, что всё то зло, которые Вы сделали Близнецам в скором времени ВЕРНЕТСЯ ВАМ БУМЕРАНГОМ! И случится это В САМЫЙ НЕПОДХОДЯЩИЙ ДЛЯ ВАС МОМЕНТ!!! Не удивляйтесь потом.??Рак. 30 мая. ??	ам по фиг на внешнюю красоту, дешевые понты и прочую чушь — главное, чтобы человек хорошо и с уважением к Ним относился. Остальное мелочи.??Лев. 30 мая. ??Сколько уже раз Лев наступал на одни и те же грабли, сколько раз уже обжигался, сколько боли испытал, а всё равно продолжает ДОВЕРЯТЬ ЛЮДЯМ.. Похоже на то, что 	 неисправимый оптимист..??	. 30 мая. ??Девы никогда не понимали и не поймут, как можно делить любимого человека с кем-то еще!? Да никогда в жизни!!! Да, Девы ревнивые!!!??	. 30 мая. ??Весов надо завоевывать, а не задалбывать.??Скорпион. 30 мая. ??Люди, НИКОГДА, СЛЫШИТЕ, НИКОГДА не испытывайте терпение 	а!!! Его доброта не безгранична!!! И не дай Вам Бог переступить эту границу.. Бегство не поможет..??	. 30 мая. ??Люди, берегите отношения со Стрельцами. Иначе будите беречь потом, только воспоминания.??Козерог. 30 мая. ??Если Вы думаете, что Козероги клюют на внешность, бабосы и социальный статус, то можете смело ИДТИ НА ФИГ. Для 	а важнее всего душа.. оптимизм.. дружелюбие.. доброта.. и уважение..??	. 30 мая. ??Водолеи вас кто-то сильно любит, но боится признаться в своих чувствах!??Рыбы. 30 мая. ??	, научитесь обижаться на людей, а то вы слишком быстро всех прощаете, а потом наступаете на те же грабли.@moygoroskop ??	30.05.2020
. 31 мая. ??Иногда, Овну для того, чтобы успокоиться, нужно разнести всё к чертям!??	. 31 мая. ??Тельцы — это будет неделя незабываемых приключений, ярких впечатлений, ошеломительного секса, вина и позитива! Будет офигительно круто!??Близнецы. 31 мая. ??	 — вся фигня позади. Теперь Вы будете наслаждаться длинной белой счастливой полосой... Полосой Вашей судьбы..?? Рак. 31 мая. ??	и — эта неделя будет легкой, приятной, позитивной и полной сюрпризов.. Вам безумно понравится!?? 	. 31 мая. ??Львы — эта неделя станет для Вас неделей больших жизненных побед, важных событий и принятия судьбоносных решений.?? 	. 31 мая. ??Девы — эта неделя будет станет для Вас неделей больших перемен.. Кардинальных, резких, ошеломительных.. ПЕРЕМЕН К ЛУЧШЕМУ!!!??Весы. 31 мая. ??	 — на этой неделе с Вами случиться столько всего хорошего, что Вы будете, мягко говоря, в шоке!!! Но, это будет одна из лучших недель в Вашей жизни!?? Скорпион. 31 мая. ??Люди, берегите нервы Скорпиона — серьезно. Когда Вы бережете нервы 	а — Вы бережете себя. Помните это.??Стрелец. 31 мая. ??Сколько можно повторять — 	 никогда и ни за кем бегать не собирается! Если Вы действительно нуждаетесь в Стрельце — ПОДОШЛИ и СКАЗАЛИ. Всё очень просто.??Козерог. 31 мая. ??Больше всего 	и ценят тех людей, которые умеют быть верными и надёжными. Людей, которые никогда не тараторят попусту, выполняют свои обещания, и, в которых можно быть точно уверенным, что Они никогда не предадут и всегда будут рядом. Да, таких мало, но.. Они есть.. Спасибо Им за это.?? 	. 31 мая. ??Водолеи - Вы встретите своего идеального человека.. Берегите его..??Рыбы.31 мая. ??	 — это будет неделя безумных приключений, ярких эмоций, бешеной страсти, необузданных порывов чувств и романтики.. Всё, как в кино.. Всё, как Вы заказывали..@moygoroskop ??	31.05.2020
. 1 июня. ??Овны — кто-то безумно скучает по Вам.. Но, ох уж это чертово расстояние...??	. 1 июня. ??У Тельца в жизни с сегодняшнего дня начинается длинная и затяжная белая полоса..??	. 1 июня. ??Близнеца бесит, когда теряются люди. А спустя месяцы они приползают и начинают нести какой-то бред о дружбе, о любви или о том, что скучали..?? Рак. 1 июня. ??Рак уже больше не верит словам. Ему их говорили слишком часто.. Настолько часто, что у 	а уже выработался иммунитет к балаболам..??	. 1 июня. ??Львам не нужен идеальный человек. Им нужен тот, с кем они смогут дурачиться, кто-то, кто будет к ним хорошо относиться и кому нравиться быть с ними больше, чем все остальное. И каждому из вас, я думаю, тоже нужен такой человек.??	. 1 июня. ??Девы — скоро в Вашей жизни появится человек, который поможет забыть Вам прошлое.. Да, что там прошлое — с ним рядом Вы забудете обо всем на свете и всецело отдадитесь любви и нежности!??Весы. 1 июня. ??Да, Весы с болью переживают, когда кто-то ни с того, ни с сего уходит из их жизни.. Но, 	 сильные.. Они сумеют найти замену всякому, кто их предал.. Но тех людей, кто остался — Они будут ценить, любить и беречь, как зеницу ока..??Скорпион. 1 июня. ??Завоевать 	а не так уж и сложно, достаточно просто всегда быть с Ним рядом, заставлять Его смеяться, любить Его, обожать, не оставлять в трудную минуту и никогда не оставлять..))??	. 1 июня. ??Стрельцы - Вы встретите своего идеального человека.. Берегите его..??Козерог. 1 июня. ??У Козерогов в жизни скоро все наладится, Их ждет вино, конфеты и массаж! И пусть весь мир к чертям собачьим катится! У 	ов будет все, блин, супер! Класс!))??	 .1 июня. ??Водолеи — кто-то очень-очень Вас ревнует.. Ревнует и медленно сходит с ума.. Но не говорит Вам об этом, потому что думает, что Вам на него абсолютно пофиг.. А ведь это не так..??Рыбы. 1 июня. ??	 — этот июнь подарит Вам красивые, нежные, крепкие и долгие-долгие отношения с человеком, который будет любить Вас больше жизни.@moygoroskop ??	01.06.2020
. 2 июня.??Овнам стоит серьезно отнестись к просьбе о помощи, которую он может сегодня услышать. Сегодня не стоит себя накручивать Овнам, все намного проще, чем, кажется.??	. 2 июня.??Любовь, отдых и развлечения ждут сегодня Тельцов. Больше проводите времени дома. Разделите свое хорошее настроение с близкими людьми.??	. 2 июня.??Звезды обещают Близнецам один из запоминающихся и ярких дней в этом месяце. Солнце будет светить в любви, работе и общественной жизни.??	. 2 июня.??Вы склонны считать неразрешимой проблему, которая таковой вовсе не является. Не стоит отравлять себе жизнь пустыми переживаниями, а то как бы судьба не подбросила вам реальный повод для расстройства.??	. 2 июня.??Этот день должен быть удачным. Он просто не может им не быть. Особенно хорошо у вас будут получаться те дела, которые вы отложили некоторое время назад. За сегодняшний день вы сможете подчистить почти все хвосты.??	. 2 июня.??Трудно, конечно оставаться оптимистом, стоя на распутье. Но судьба к вам не так уж неблагосклонна. Сегодня вам здорово помогут друзья.??	. 2 июня.??Не слишком заглядывайтесь на свое отражение сегодня, вы можете быть ослеплены собственным сиянием. Остается лишь посочувствовать окружающим вас людям. Но вы прекрасны!?? 	. 2 июня.??Соблюдайте осторожность и не торопите события: пусть идут своим чередом. Постарайтесь остаться сторонним наблюдателем и не особо вмешиваться в процесс.??	. 2 июня.??Сегодня ваш день в полном смысле этого слова. Однако, находясь на вершине успеха, не забудьте закрепить его и в дальнейшем действовать таким же образом.??	. 2 июня.??Близкие люди могут приставать к вам с советами – постарайтесь их выслушать. Есть высокие шансы, что вы услышите в их словах подсказку, в которой давно нуждались. ??	. 2 июня??Сегодня вам стоит разогнать грусть раз и навсегда. Распускать сопли - это гнилое дело. Стоять на месте - не ваш удел, по крайней мере сегодня.??	. 2 июня.??У вас есть прекрасная возможность провести день с толком. Хватит валяться на диване, будьте активнее. Встреча с друзьями и кучей позитива обеспечена.@moygoroskop ??	02.06.2020
