Овны	Тельцы	Близнецы	Рак	Лев	Девы	Весы	Скорпион	Стрелец	Козерог	Водолей	Рыбы	date
 Вы склонны считать неразрешимой проблему, которая таковой вовсе не является. Не стоит отравлять себе жизнь пустыми переживаниями, а то как бы судьба не подбросила вам реальный повод для расстройства. ?? 	 Сегодня наилучшим образом вы будете себя чувствовать полностью во что-нибудь погрузившись. Если вы не любитель продолжительных водных процедур, значит это будет книга или авантюра - на выбор. ?? 	 Вокруг вас сегодня может собраться слишком много людей, советующих вам как жить дальше, чтобы их можно было выносить. Придется поискать какое-нибудь убежище, иначе день этот не принесет ничего, кроме раздражения. ?? 	 Сегодняшний день будет зависеть от того, как вы его начнете, сможете ли поймать верный ритм действий. Не позволяйте слишком себя торопить, это приведет лишь к полной недееспособности. ?? 	 Сегодня вас, возможно, будет мучить ощущение, что вы совершили ошибку и потратили время и деньги впустую. Не стоит мучить себя подобными мыслями, тот факт, что ожидаемый результат задерживается, еще не означает, что его не будет вовсе. ?? 	 Сегодня вы одержите пусть небольшую, но победу. Этот день принесет вам уважение окружающих. ?? 	 Сегодня не стоит ни на шаг отходить от собственных принципов. Принципиальность будет оценена по достоинству, а положительная оценка всегда полезна, от кого бы она ни исходила. ?? 	 Не позвольте упрямству или непониманию, а этим вы и будете грешить сегодня, обречь вас на одиночество. Лучше уступить. ?? 	 Сегодня для вас не будет ничего невозможного. Правда, вы рискуете потратить слишком много времени на любование собственным могуществом. Если вам удастся сократить этот процесс, то, вполне вероятно, что день будет продуктивным. ?? 	 Поищите смешную сторону во всякой дурацкой ситуации, в которую попадете. Обхохочетесь, ибо сегодня их будет предостаточно. ?? 	 Сегодня ваш творческий потенциал вырастет до такой степени, что просто перестанет в вас помещаться. Хольте его, лелейте, и не забывайте использовать на всю катушку. ?? 	 Не ешьте сегодня на завтрак тяжелой пищи, это поможет вам сохранить хорошее настроение до конца дня. На работе постарайтесь остаться в стороне от излишне горячих дискуссий.@tvoygoroskopru ??	13.12.2020
. 3 января. ?Овны — кто-то безумно скучает по Вам.. Но, ох уж это чертово расстояние...?	. 3 января. ?У Тельца в жизни с сегодняшнего дня начинается длинная и затяжная белая полоса..?	. 3 января. ?Близнеца бесит, когда теряются люди. А спустя месяцы они приползают и начинают нести какой-то бред о дружбе, о любви или о том, что скучали..? Рак. 3 января. ?Рак уже больше не верит словам. Ему их говорили слишком часто.. Настолько часто, что у 	а уже выработался иммунитет к балаболам..?	. 3 января. ?Львам не нужен идеальный человек. Им нужен тот, с кем они смогут дурачиться, кто-то, кто будет к ним хорошо относиться и кому нравиться быть с ними больше, чем все остальное. И каждому из вас, я думаю, тоже нужен такой человек.?	. 3 января. ?Девы — скоро в Вашей жизни появится человек, который поможет забыть Вам прошлое.. Да, что там прошлое — с ним рядом Вы забудете обо всем на свете и всецело отдадитесь любви и нежности!?Весы. 3 января. ?Да, Весы с болью переживают, когда кто-то ни с того, ни с сего уходит из их жизни.. Но, 	 сильные.. Они сумеют найти замену всякому, кто их предал.. Но тех людей, кто остался — Они будут ценить, любить и беречь, как зеницу ока..?Скорпион. 3 января. ?Завоевать 	а не так уж и сложно, достаточно просто всегда быть с Ним рядом, заставлять Его смеяться, любить Его, обожать, не оставлять в трудную минуту и никогда не оставлять..))?	. 3 января. ?Стрельцы — буквально на днях с Вами случится что-то, что полностью изменит Ваши планы .. В офигительную сторону!?Козерог. 3 января. ?У Козерогов в жизни скоро все наладится, Их ждет вино, конфеты и массаж! И пусть весь мир к чертям собачьим катится! У 	ов будет все, блин, супер! Класс!))?	 .3 января. ?Водолеи — кто-то очень-очень Вас ревнует.. Ревнует и медленно сходит с ума.. Но не говорит Вам об этом, потому что думает, что Вам на него абсолютно пофиг.. А ведь это не так..?Рыбы. 3 января. ?	 — этот январь подарит Вам красивые, нежные, крепкие и долгие-долгие отношения с человеком, который будет любить Вас больше жизни.@tvoygoroskopru ??	03.01.2020
. 4 января. ?Овны - Вы думали отметили Новый Год и всё!? Нифига!!! Вы будете праздновать и отрываться по-полной еще, как минимум неделю!!!))?	. 4 января. ?Тельцы — январь станет для Вас месяцем больших побед и принятия очень важных решений.. Вас ждет очень большой успех в 2018-м году!!!?Близнецы. 4 января. ?	 — январь станет для Вас месяцем крутых душевных посиделок, празднований, алкоголя, новых знакомств, вкусняшек и позитива.. Всё, как Вы любите..?Рак. 4 января. ?	и — этот январь будет непрост, иногда будет очень трудно.. Но, так надо.. Зато потом у Вас начнется огромная длинная затяжная белая полоса!)) Вы будете самыми счастливыми людьми на Земле..? Лев. 4 января. ?Лев до сих пор не может поверить в то, что Он уже не в 2017-м, а в 2018-м.. Но, уже совсем скоро 	 поймет насколько этот год офигительней чем прошлый..?	. 4 января. ?В Новом Году Девы хотят, чтобы началась новая жизнь. Попрощаться с ненужными людьми. Чтобы окружали только верные, искренние друзья. Чтобы любимый человек был рядом. Родители жили долго-долго. И, чтобы исполнились все их мечты.?Весы. 4 января. ?	 - то, что Вы загадали себе на Новый Год начнет потихоньку сбываться уже со следующей недели..))?Скорпион. 4 января. ?	ы — в этом январе с Вами случится очень много хороших вещей, которые раз и навсегда изменят Вашу жизнь.. Со многими людьми придется попрощаться, а многие вещи выбросить.. Но, так нужно.. Вы наконец-то вздохнете с облегчением и заживете счастливой беззаботной жизнью..))?	. 4 января. ?Стрельцы — январь станет для Вас месяцем офигительных знакомств, свиданий, приключений и больших позитивных перемен в личной жизни.. Готовьтесь..))? Козерог. 4 января. ?Козероги — этот январь подарит Вам счастье.. Самое настоящее счастье.. Да-да, 	и — оно накроет Вас с головой..))?	. 4 января. ?Водолеи — Дед Мороз услышал Ваше Новогоднее пожелание.. И решил, что таки-да.. Скоро Оно начнет исполнятся..))?Рыбы. 4 января. ?	 — Вас ждет какая-то очень большая внезапная радость..@tvoygoroskopru ??	04.01.2020
. 5 января. ?Овны - в Вашей жизни вот-вот должно произойти кое-что очень важное.. Важное, доброе, чистое и светлое.. С минуты на минуту..?	" . 5 января. ?Тельцов запарила вся эта фигня , Тельцы хотят любви, большой и чистой.. Не той фигни, что в ""50 оттенков серого"", а такой, как в ""Ромео и Джульетте"".. Чтобы вместе и навсегда..?Близнецы. 5 января. ?Если Близнец чего-то или кого-то захотел.. То это все.. У этого объекта нет шансов.. Близнец заполучит его любой ценой.. Да-да, "	 такие..? Рак . 5 января. ?	и - качайте руки..)) Ваши руки должны быть сильными для того, чтобы унести тот офигительно огромный подарок, который приготовила для Вас судьба..)?Лев. 5 декабря. ?Пусть исчезнут войны и теракты! 	 за МИР, ЛЮБОВЬ и половые акты!?	. 5 декабря. ?Девы - сегодня Вас ждет 50 оттенков любви, блаженства и наслаждения..?Весы. 5 декабря. ?	 — в Вас офигенно влюбится один очень ласковый мерзавец.. Ждите приключений..?Скорпион. 5 декабря. ?Вы даже не представляете себе, как 	ы запарились. Душевно.. Как же им хочется уехать туда, где люди добрей, чувства теплей и взаимной и много много много теплого океана..?	. 5 декабря. ?В каждом Стрельце, живет маленькая психованная истеричка. Факт.?Козерог. 5 января. ?Козероги - у Вас появился тайный поклонник, который просто изнемогает одинокими холодными ночами без Вас.. Все его мысли заняты только Вами.. Он реально бредит Вами.. Это пипец, 	и.. Что ж Вы творите-то??	. 5 января. ?Водолеи - научитесь отпускать людей.. Ведь те, кто Вас любят и ценят будут с Вами ни смотря ни на что!!!!?	. 5 января. ?Рыбам так приятно осознавать, что где-то за них переживают, где-то по ним скучают, любят и ждут.@tvoygoroskopru ??	05.01.2020
. 6 января. ?Овны, пора начинать спать по ночам!?? 	". 6 января. ?Тельцы часто говорят, что всё нормально, а ночью задыхаются от боли..??Близнецы. 6 января. ?Когда Близнецов называют ""солнышко"" — они светятся. когда называют ""любимая""- они любят. когда называют ""моя нежная"" — они задаривают ласками. а когда вы молчите - они становятся равнодушными. всё очень просто. "	 взаимны до невозможности.??Рак. 6 января. ?	и, все будет так как вы мечтаете, только подождите!??	. 6 января. ?Вот теперь-то у Львов всё будет хорошо. Можете не сомневаться. Это белая полоса.??	. 6 января. ?У Девы в голове одно имя.??Весы. 6 января. ?	, чем больше внимания вы уделяете человеку – тем больше ему плевать на вас. Запомните!!!??Скорпион. 6 января. ?	"ов уже абсолютно ничего не расстраивает и не удивляет. всё ""окей"" в любом случае.??"	". 6 января. ?В жизни Стрельцов сейчас есть один человек, ради звонка которого они проснутся даже три часа ночи.??Козерог. 6 января. ?Люди — не говорите Козерогу ""люблю"", если не готовы подтвердить свои слова делами.. "	 Вам этого не простит.. А вернуть Его доверие будет уже невозможно..??	. 6 января. ?Рассказать вам, от чего Водолеи становятся черствым и циничным? От того, что их предавали, бросали или меняли на других людей, за которых они могли отдать если не все, то очень многое.??Рыбы. 6 января. ?Мандаринки, объятия любимого человека и мартини — вот, что сейчас нужно Рыбам.. Ах, да — и массаж еще.. Хороший такой, добротный массаж! 	 — не печальтесь, совсем скоро все будет!))@tvoygoroskopru ??	06.01.2020
. 17 марта. Сегодня вашему любимому человеку будет стыдно за какие-то свои поступки или даже мысли, причем стыдно перед вами. Если вы считаете, что у него нет никаких оснований для подобных чувств, постарайтесь его в этом убедить как можно быстрее, для вашего же блага и для блага ваших отношений.??	. 17 марта. Тельцы нынче сами выкуют своё счастье. Но кто-то может перепутать лекала, и у него получится не совсем то, что нужно. Руководствуйтесь в принятии решений (а сегодняшние могут очень здорово повлиять на вашу жизнь) и чувствами, и разумом. Складывать всю ответственность на одного из этой пары не стоит - не справится.??	. 17 марта. Сегодня звезды рекомендуют вам с вашим любимым человеком посмотреть вместе какой-нибудь веселый, интересный и занимательный фильм, который обязательно поднимет ваше настроение и подкинет пару-тройку тем для дальнейшего обсуждения, а значит, сделает вас ближе друг другу.??	. 17 марта. Расслабьтесь и пустите все на самотек. Даже если у вас с вашим любимым человеком на данный момент возникают какие-то проблемы, сегодня вы их решить все равно не сможете: не хватит ни душевных, ни физических сил. Единственное, что вы можете сделать - это убедить себя в верности жизненного правила: «Упремся — разберемся».??	. 17 марта. В этот день ваш любимый человек не будет соответствовать вашим представлениям о том, каким он должен быть в идеале, поэтому множество придирок с вашей стороны неизбежно. Но, в конце концов, он не виноват, что так получилось и что вы придумали для себя недосягаемый идеал.??	.17 марта. Сегодня вашему любимому человеку предстоит нелёгкий день, и только вы сможете сделать всё возможное для того, чтобы день этот стал для него куда светлее, ярче, солнечнее и радостнее. Вы даже не представляете, на какие чудеса способны, стоит только этого действительно захотеть!??	. 17 марта. Ваш сегодняшний день будет грустен и безрадостен, поэтому вам стоит подготовиться к этому заранее и вашего любимого человека к этому подготовить. Пусть он не удивляется вашим стремительным перепадам настроениям и периодическим срывам на крик. И вы постарайтесь сдерживаться.??	. 17 марта. Сегодня вам стоит подумать не только о том, насколько вам хорошо с вашим любимым человеком, но и о том, как ваш тандем воспринимают окружающие. Если не совсем благоприятно, то, может быть, стоит пересмотреть ваше поведение на людях, сделать его более адекватным?..?? 	. 17 марта. Помимо вашего любимого человека в мире есть ещё множество людей, которым вы дороги. Поэтому даже если сегодня между вами разгорится ссора, плавно перетекающая в скандал и грозящая расставанием, это не конец света. Во-первых, в итоге все равно все будет хорошо, а во-вторых, в любом случае в гордом одиночестве вы не останетесь.??	. 17 марта  Вы сегодня можете всерьез задуматься о смене работы. Но пусть даже вы недовольны всем: местом, где работаете, служебным положением, зарплатой - не надо спешить. Оценивайте свои возможности реально.??	. 17 марта. Сегодня вашему любимому человеку будет непросто уговорить вас на какой-то поступок, который с его точки зрения будет более чем правильным, естественным и логичным, а с вашей - апофеозом безумства и нелогичности. Компромисса, увы, звёзды тут не видят: придётся делать выбор.?? 	. 17 марта. Сегодня ваш любимый человек узнает о вас что-то такое, о чём вы не хотели ему по тем или иным причинам говорить. Не самая приятная ситуация, но она может окончиться и хорошо, если он лишь удивлённо поинтересуется, почему же вы раньше молчали, ведь всё могло быть куда проще.@moygoroskop ??	17.03.2020
